[
  {
    "evidence_id": "ev-020",
    "source_type": "email",
    "captured_at": "2026-03-01T10:00:00Z",
    "document_date": "2026-03-01T10:00:00Z",
    "content_ref": "fixtures/conflicting_records/raw/ev-020-employee-account.txt",
    "content_hash": null,
    "supersedes": null,
    "is_synthetic": true
  },
  {
    "evidence_id": "ev-021",
    "source_type": "document",
    "captured_at": "2026-03-02T11:00:00Z",
    "document_date": "2026-03-02T11:00:00Z",
    "content_ref": "fixtures/conflicting_records/raw/ev-021-manager-note.txt",
    "content_hash": null,
    "supersedes": null,
    "is_synthetic": true
  }
]
