[
  {
    "evidence_id": "ev-040",
    "source_type": "email",
    "captured_at": "2026-01-20T08:00:00Z",
    "document_date": "2026-01-20T08:00:00Z",
    "content_ref": "fixtures/unresolved_handoff/raw/ev-040-reimbursement-request.txt",
    "content_hash": null,
    "supersedes": null,
    "is_synthetic": true
  },
  {
    "evidence_id": "ev-041",
    "source_type": "email",
    "captured_at": "2026-01-22T10:00:00Z",
    "document_date": "2026-01-22T10:00:00Z",
    "content_ref": "fixtures/unresolved_handoff/raw/ev-041-hr-forward-notice.txt",
    "content_hash": null,
    "supersedes": null,
    "is_synthetic": true
  }
]
