[
  {
    "evidence_id": "ev-050",
    "source_type": "email",
    "captured_at": "2026-04-01T09:00:00Z",
    "document_date": "2026-04-01T09:00:00Z",
    "content_ref": "fixtures/proposed_communication_approval/raw/ev-050-status-check.txt",
    "content_hash": null,
    "supersedes": null,
    "is_synthetic": true
  }
]
